{
  "$schema": "./policy.schema.json",
  "version": 1,
  "policy_id": "COGLATAS-GOVERNANCE",
  "repository": "NYGsatoshi/Coglatas",
  "default_branch": "main",
  "owners": [
    "@NYGsatoshi"
  ],
  "semantics": {
    "live_state_is_baseline": false,
    "unknown_control_behavior": "reject",
    "unknown_field_behavior": "reject",
    "invalid_policy_behavior": "block",
    "implicit_critical_defaults": "forbidden",
    "downgrade_requires_explicit_diff": true
  },
  "waiver_rules": {
    "bounded": {
      "owner_required": true,
      "reason_required": true,
      "expiry_required": true,
      "tracking_issue_required": true,
      "max_duration_days": 30
    }
  },
  "controls": [
    {
      "id": "GOV-RULESET-001",
      "family": "ruleset",
      "title": "Default branch protection and ruleset contract",
      "purpose": "Keep the protected default-branch rulesets explicit and reviewable instead of learning policy from live GitHub state.",
      "scope": [
        "default-branch",
        "scheduled"
      ],
      "enforcement": "blocking",
      "owner": "@NYGsatoshi",
      "expected": {
        "target": "default-branch",
        "ruleset_names": [
          "Public Main Protection - Strict External Review",
          "PRreview"
        ],
        "strict_required_status_checks": true,
        "branch_deletion_allowed": false,
        "non_fast_forward_allowed": false
      },
      "evidence": {
        "kind": "github-live-settings",
        "source": "trusted default-branch ruleset snapshot"
      },
      "exception": {
        "allowed": false
      },
      "references": {
        "paths": [],
        "workflows": [],
        "checks": [],
        "rulesets": [
          "Public Main Protection - Strict External Review",
          "PRreview"
        ]
      },
      "failure_classification": "configuration-drift"
    },
    {
      "id": "GOV-CHECKS-001",
      "family": "required-status-checks",
      "title": "Required pull-request status checks",
      "purpose": "Pin merge-required CI and routed Functional/API Performance aggregates so missing, cancelled, skipped, failed or stale required work fails closed from one repository-owned contract.",
      "scope": [
        "pr",
        "default-branch"
      ],
      "enforcement": "blocking",
      "owner": "@NYGsatoshi",
      "expected": {
        "strict": true,
        "missing_or_stale": "fail",
        "required": [
          {
            "kind": "workflow-job",
            "workflow": ".github/workflows/ci.yml",
            "job": "build-test",
            "context": "build-test"
          },
          {
            "kind": "workflow-job",
            "workflow": ".github/workflows/ci.yml",
            "job": "frontend-test",
            "context": "frontend-test"
          },
          {
            "kind": "workflow-job",
            "workflow": ".github/workflows/ci.yml",
            "job": "security-scan",
            "context": "security-scan"
          },
          {
            "kind": "workflow-job",
            "workflow": ".github/workflows/publication-readiness.yml",
            "job": "publication-readiness",
            "context": "publication-readiness"
          },
          {
            "kind": "workflow-job",
            "workflow": ".github/workflows/ci.yml",
            "job": "functional-fast",
            "context": "functional-fast"
          },
          {
            "kind": "workflow-job",
            "workflow": ".github/workflows/performance-api.yml",
            "job": "gate",
            "context": "performance-fast"
          }
        ]
      },
      "evidence": {
        "kind": "status-context",
        "source": "authoritative exact-head commit status/check-runs"
      },
      "exception": {
        "allowed": false
      },
      "references": {
        "paths": [
          "scripts/ci/check-required-pr-checks.py",
          "governance/required-checks.json",
          "governance/required-checks.schema.json",
          "docs/verification/governance-required-checks.md"
        ],
        "workflows": [
          ".github/workflows/ci.yml",
          ".github/workflows/publication-readiness.yml",
          ".github/workflows/performance-api.yml"
        ],
        "checks": [
          {
            "kind": "workflow-job",
            "workflow": ".github/workflows/ci.yml",
            "job": "build-test",
            "context": "build-test"
          },
          {
            "kind": "workflow-job",
            "workflow": ".github/workflows/ci.yml",
            "job": "frontend-test",
            "context": "frontend-test"
          },
          {
            "kind": "workflow-job",
            "workflow": ".github/workflows/ci.yml",
            "job": "security-scan",
            "context": "security-scan"
          },
          {
            "kind": "workflow-job",
            "workflow": ".github/workflows/publication-readiness.yml",
            "job": "publication-readiness",
            "context": "publication-readiness"
          },
          {
            "kind": "workflow-job",
            "workflow": ".github/workflows/ci.yml",
            "job": "functional-fast",
            "context": "functional-fast"
          },
          {
            "kind": "workflow-job",
            "workflow": ".github/workflows/performance-api.yml",
            "job": "gate",
            "context": "performance-fast"
          }
        ],
        "rulesets": [
          "Public Main Protection - Strict External Review"
        ]
      },
      "failure_classification": "configuration-drift"
    },
    {
      "id": "GOV-SIGNATURE-001",
      "family": "required-signatures",
      "title": "Commit signature policy",
      "purpose": "Do not make commit signatures a merge-blocking requirement; preserve original PR commit history and rely on required CI plus repository permissions for merge protection.",
      "scope": [
        "default-branch"
      ],
      "enforcement": "blocking",
      "owner": "@NYGsatoshi",
      "expected": {
        "required": false
      },
      "evidence": {
        "kind": "github-live-settings",
        "source": "trusted default-branch ruleset snapshot"
      },
      "exception": {
        "allowed": false
      },
      "references": {
        "paths": [],
        "workflows": [],
        "checks": [],
        "rulesets": [
          "Public Main Protection - Strict External Review"
        ]
      },
      "failure_classification": "configuration-drift"
    },
    {
      "id": "GOV-REVIEW-001",
      "family": "pr-review-codeowners",
      "title": "Pull request review and CODEOWNERS contract",
      "purpose": "Keep external-contributor review expectations explicit while owner-authored changes remain mergeable without a synthetic commit-status gate; native rules enforce PR and thread semantics.",
      "scope": [
        "pr",
        "default-branch"
      ],
      "enforcement": "blocking",
      "owner": "@NYGsatoshi",
      "expected": {
        "pull_request_required": true,
        "approvals_required": 0,
        "codeowners_review_required": false,
        "unattributed_changes_require_additional_approval": false,
        "dismiss_stale_reviews_on_push": false,
        "require_last_push_approval": false,
        "required_review_thread_resolution": true,
        "author_cannot_self_approve": true,
        "minimum_distinct_codeowners": 1,
        "external_pr_current_head_approval_required": true,
        "external_pr_approval_reviewer": "@NYGsatoshi",
        "external_approval_reviewer_must_be_codeowner": true,
        "owner_authored_pr_external_approval_required": false,
        "draft_pr_blocks": true,
        "changes_requested_blocks": true,
        "previous_head_approval_satisfies": false,
        "codeowners_fallback_required": true,
        "codeowners_required_explicit_patterns": [
          "/.github/",
          "/scripts/ci/",
          "/governance/",
          "/.npmrc",
          "/global.json",
          "/package.json",
          "/package-lock.json",
          "/Dockerfile",
          "/docker-compose.yml",
          "/deploy/",
          "/COPYRIGHT.md",
          "/CONTRIBUTING.md",
          "/THIRD_PARTY_NOTICES.md",
          "/.github/SECURITY.md",
          "/docs/SECURITY.md",
          "/docs/SECURITY_MODEL.md"
        ],
        "codeowners_sensitive_paths": [
          ".github/CODEOWNERS",
          ".github/workflows/ci.yml",
          ".github/workflows/publication-readiness.yml",
          ".github/workflows/external-pr-approval-evaluator.yml",
          "scripts/ci/check-governance-review-status-invariants.py",
          "scripts/ci/evaluate-governance-pr-review.py",
          "governance/policy.json",
          "governance/policy.schema.json",
          "global.json",
          "package.json",
          "package-lock.json",
          ".npmrc",
          "Dockerfile",
          "docker-compose.yml",
          "deploy/gcp/README.md",
          "COPYRIGHT.md",
          "CONTRIBUTING.md",
          "THIRD_PARTY_NOTICES.md",
          ".github/SECURITY.md",
          "docs/SECURITY.md",
          "docs/SECURITY_MODEL.md"
        ]
      },
      "evidence": {
        "kind": "github-live-settings",
        "source": "trusted review/ruleset evaluator"
      },
      "exception": {
        "allowed": false
      },
      "references": {
        "paths": [
          ".github/CODEOWNERS",
          "scripts/ci/check-governance-review-status-invariants.py",
          "scripts/ci/evaluate-governance-pr-review.py"
        ],
        "workflows": [
          ".github/workflows/external-pr-review-signal.yml",
          ".github/workflows/external-pr-approval-evaluator.yml"
        ],
        "checks": [],
        "rulesets": [
          "PRreview"
        ]
      },
      "failure_classification": "review-policy-drift"
    },
    {
      "id": "GOV-BYPASS-001",
      "family": "bypass-actors",
      "title": "Bypass actor policy",